{
  "cicd_score": 100.0,
  "counts": {
    "cicd_checks": {
      "passed": 15,
      "total": 15
    },
    "tasks": {
      "passed": 17,
      "total": 17
    },
    "visual_checkpoints": {
      "passed": 19,
      "total": 19
    }
  },
  "reward": 1.0,
  "reward_source": "task_completion",
  "schema_version": "websitebench.harbor.score.v2",
  "status": "VALID_RUN",
  "task_score": 100.0,
  "visual_score": 99.99999995
}
